{
  "tool": "regionlock",
  "version": "1.0.0-dev",
  "generatedAt": "2026-07-05T15:30:15Z",
  "source": "testdata/violating",
  "ruleset": {
    "id": "eu-data-residency-v1",
    "version": "1.0.0",
    "title": "EU Data Residency \u0026 Sovereignty Baseline",
    "jurisdiction": "European Union",
    "updated": "2026-07-05"
  },
  "summary": {
    "resources": 8,
    "checks": 9,
    "pass": 0,
    "fail": 9,
    "skip": 0,
    "score": 0,
    "compliant": false
  },
  "ruleScores": [
    {
      "ruleId": "customer-managed-key",
      "ruleName": "Storage uses customer-managed keys",
      "severity": "medium",
      "pass": 0,
      "fail": 1,
      "skip": 0,
      "articles": [
        {
          "regulation": "GDPR",
          "article": "Art. 32",
          "title": "Security of processing",
          "url": "https://gdpr-info.eu/art-32-gdpr/"
        }
      ],
      "remediation": "Use a customer-managed key: annotate the PVC with regionlock.io/cmk-key-id=\u003ckms-key-id\u003e, or use a StorageClass whose parameters set a CMK (kmsKeyId, diskEncryptionSetID, or disk-encryption-kms-key)."
    },
    {
      "ruleId": "encryption-at-rest",
      "ruleName": "Encryption at rest declared",
      "severity": "medium",
      "pass": 0,
      "fail": 1,
      "skip": 0,
      "articles": [
        {
          "regulation": "GDPR",
          "article": "Art. 32",
          "title": "Security of processing",
          "url": "https://gdpr-info.eu/art-32-gdpr/"
        }
      ],
      "remediation": "Declare encryption at rest: label the PVC regionlock.io/encrypted=\"true\", or use an approved encrypted StorageClass listed in approvedStorageClasses."
    },
    {
      "ruleId": "eu-region-placement",
      "ruleName": "Workloads pinned to an EU region",
      "severity": "high",
      "pass": 0,
      "fail": 3,
      "skip": 0,
      "articles": [
        {
          "regulation": "GDPR",
          "article": "Art. 44",
          "title": "General principle for transfers",
          "url": "https://gdpr-info.eu/art-44-gdpr/"
        },
        {
          "regulation": "GDPR",
          "article": "Art. 45",
          "title": "Transfers on the basis of an adequacy decision",
          "url": "https://gdpr-info.eu/art-45-gdpr/"
        },
        {
          "regulation": "EU Data Act",
          "article": "Art. 32",
          "title": "International governmental access and transfer of non-personal data",
          "url": "https://eur-lex.europa.eu/eli/reg/2023/2854/oj"
        }
      ],
      "remediation": "Pin the workload to an in-territory region: set topology.kubernetes.io/region (via nodeSelector, or a required nodeAffinity In term on EVERY term) to one of the ruleset's allow-listed regions. On a single-region cluster, set clusterRegion instead of labelling every workload."
    },
    {
      "ruleId": "no-non-eu-egress",
      "ruleName": "No unrestricted or extra-EU egress",
      "severity": "high",
      "pass": 0,
      "fail": 4,
      "skip": 0,
      "articles": [
        {
          "regulation": "GDPR",
          "article": "Art. 44",
          "title": "General principle for transfers",
          "url": "https://gdpr-info.eu/art-44-gdpr/"
        },
        {
          "regulation": "GDPR",
          "article": "Art. 46",
          "title": "Transfers subject to appropriate safeguards",
          "url": "https://gdpr-info.eu/art-46-gdpr/"
        }
      ],
      "remediation": "Keep traffic in-territory: drop Service type=ExternalName and spec.externalIPs, and replace unrestricted NetworkPolicy egress (0.0.0.0/0, ::/0, or 0.0.0.0/1 + 128.0.0.0/1 splits) with explicit in-territory CIDRs."
    }
  ],
  "namespaces": [
    {
      "namespace": "shop",
      "pass": 0,
      "fail": 9,
      "skip": 0,
      "score": 0
    }
  ],
  "findings": [
    {
      "ruleId": "customer-managed-key",
      "ruleName": "Storage uses customer-managed keys",
      "severity": "medium",
      "status": "fail",
      "kind": "PersistentVolumeClaim",
      "name": "orders-data",
      "namespace": "shop",
      "message": "no customer-managed key (annotation regionlock.io/cmk-key-id, or a StorageClass with a CMK parameter)",
      "source": "testdata\\violating\\workloads.yaml#2",
      "articles": [
        {
          "regulation": "GDPR",
          "article": "Art. 32",
          "title": "Security of processing",
          "url": "https://gdpr-info.eu/art-32-gdpr/"
        }
      ],
      "remediation": "Use a customer-managed key: annotate the PVC with regionlock.io/cmk-key-id=\u003ckms-key-id\u003e, or use a StorageClass whose parameters set a CMK (kmsKeyId, diskEncryptionSetID, or disk-encryption-kms-key)."
    },
    {
      "ruleId": "encryption-at-rest",
      "ruleName": "Encryption at rest declared",
      "severity": "medium",
      "status": "fail",
      "kind": "PersistentVolumeClaim",
      "name": "orders-data",
      "namespace": "shop",
      "message": "encryption at rest not declared (label/annotation regionlock.io/encrypted=true, or an encrypted StorageClass)",
      "source": "testdata\\violating\\workloads.yaml#2",
      "articles": [
        {
          "regulation": "GDPR",
          "article": "Art. 32",
          "title": "Security of processing",
          "url": "https://gdpr-info.eu/art-32-gdpr/"
        }
      ],
      "remediation": "Declare encryption at rest: label the PVC regionlock.io/encrypted=\"true\", or use an approved encrypted StorageClass listed in approvedStorageClasses."
    },
    {
      "ruleId": "eu-region-placement",
      "ruleName": "Workloads pinned to an EU region",
      "severity": "high",
      "status": "fail",
      "kind": "Deployment",
      "name": "checkout-api",
      "namespace": "shop",
      "message": "can schedule in non-EU region(s): us-east-1",
      "source": "testdata\\violating\\workloads.yaml#0",
      "articles": [
        {
          "regulation": "GDPR",
          "article": "Art. 44",
          "title": "General principle for transfers",
          "url": "https://gdpr-info.eu/art-44-gdpr/"
        },
        {
          "regulation": "GDPR",
          "article": "Art. 45",
          "title": "Transfers on the basis of an adequacy decision",
          "url": "https://gdpr-info.eu/art-45-gdpr/"
        },
        {
          "regulation": "EU Data Act",
          "article": "Art. 32",
          "title": "International governmental access and transfer of non-personal data",
          "url": "https://eur-lex.europa.eu/eli/reg/2023/2854/oj"
        }
      ],
      "remediation": "Pin the workload to an in-territory region: set topology.kubernetes.io/region (via nodeSelector, or a required nodeAffinity In term on EVERY term) to one of the ruleset's allow-listed regions. On a single-region cluster, set clusterRegion instead of labelling every workload."
    },
    {
      "ruleId": "eu-region-placement",
      "ruleName": "Workloads pinned to an EU region",
      "severity": "high",
      "status": "fail",
      "kind": "Deployment",
      "name": "recommender",
      "namespace": "shop",
      "message": "can schedule in non-EU region(s): us-west-2",
      "source": "testdata\\violating\\affinity-egress.yaml#0",
      "articles": [
        {
          "regulation": "GDPR",
          "article": "Art. 44",
          "title": "General principle for transfers",
          "url": "https://gdpr-info.eu/art-44-gdpr/"
        },
        {
          "regulation": "GDPR",
          "article": "Art. 45",
          "title": "Transfers on the basis of an adequacy decision",
          "url": "https://gdpr-info.eu/art-45-gdpr/"
        },
        {
          "regulation": "EU Data Act",
          "article": "Art. 32",
          "title": "International governmental access and transfer of non-personal data",
          "url": "https://eur-lex.europa.eu/eli/reg/2023/2854/oj"
        }
      ],
      "remediation": "Pin the workload to an in-territory region: set topology.kubernetes.io/region (via nodeSelector, or a required nodeAffinity In term on EVERY term) to one of the ruleset's allow-listed regions. On a single-region cluster, set clusterRegion instead of labelling every workload."
    },
    {
      "ruleId": "eu-region-placement",
      "ruleName": "Workloads pinned to an EU region",
      "severity": "high",
      "status": "fail",
      "kind": "StatefulSet",
      "name": "sessions",
      "namespace": "shop",
      "message": "no EU region constraint declared (pin topology.kubernetes.io/region to an EU region on EVERY nodeAffinity term / nodeSelector, or set clusterRegion for a single-region cluster)",
      "source": "testdata\\violating\\workloads.yaml#1",
      "articles": [
        {
          "regulation": "GDPR",
          "article": "Art. 44",
          "title": "General principle for transfers",
          "url": "https://gdpr-info.eu/art-44-gdpr/"
        },
        {
          "regulation": "GDPR",
          "article": "Art. 45",
          "title": "Transfers on the basis of an adequacy decision",
          "url": "https://gdpr-info.eu/art-45-gdpr/"
        },
        {
          "regulation": "EU Data Act",
          "article": "Art. 32",
          "title": "International governmental access and transfer of non-personal data",
          "url": "https://eur-lex.europa.eu/eli/reg/2023/2854/oj"
        }
      ],
      "remediation": "Pin the workload to an in-territory region: set topology.kubernetes.io/region (via nodeSelector, or a required nodeAffinity In term on EVERY term) to one of the ruleset's allow-listed regions. On a single-region cluster, set clusterRegion instead of labelling every workload."
    },
    {
      "ruleId": "no-non-eu-egress",
      "ruleName": "No unrestricted or extra-EU egress",
      "severity": "high",
      "status": "fail",
      "kind": "NetworkPolicy",
      "name": "allow-all-egress",
      "namespace": "shop",